The selection of periodic salary increment of civil servants using fuzzy MADM,"The Fuzzy Multi Attribute Decision Making (FMADM) methods used in this study are FSAW and FTOPSIS. They are developed for the selection of Periodic Salary Increment (KGB) for the Civil Servants (PNS) of the East Kalimantan province because there is a big possibility of an error in entering data, calculating salary and calculating the time of submission in manually. The FMADM method selects and ranks employees according to qualifications for salary increases based on a number of criteria that refer to government regulations. Criteria that are used as references for salary increment selection of civil servants are includes: years of experience, assessment of Employee Performance Target (SKP) for the past two years, behavioral assessment, and disciplinary penalty. Based on the results of 40 employees data used in this study, the accuracy is as much as 90% compared with reality for FSAW, and the accuracy of FTOPSIS is as much as 85% from reality. The minimum preference threshold value is 0.70 to pass the Periodic Salary Increment selection. © 2019 IEEE.",Fuzzy; Kaltim; KGB; Saw; Topsis Decision making; Information systems; Information use; Laws and legislation; Behavioral assessment; Civil servants; Employee performance; Fuzzy MADM; Fuzzy multi-attribute decision makings; Government regulation; Kalimantan; Threshold-value; Wages
"Unsupervised anomaly detection using K-Means, local outlier factor and one class SVM","Anomaly detection is one area that is still being researched today. An anomaly that occurs in data can be utilized in various ways, such as detection of money embezzlement, increasing production, improving the quality of data, preventing attacks on a network and others. This study aims to find anomalies in the data drug use in hospitals consisting of two datasets using the K-Means algorithm, Local Outlier Factor (LOF) and One Class Support Vector Machine (OC-SVM). The results of this study are that the three algorithms can find outliers. Based on its performance in both datasets, OC-SVM outperforms LOF and K-Means © 2019 IEEE.",Anomaly detection; Data mining; K-means; Local outlier factor; One class SVM; Outlier detection K-means clustering; Statistics; Support vector machines; Increasing production; K-means; Local Outlier Factor; Local outlier factors; One class-SVM; One-class support vector machine; Quality of data; Unsupervised anomaly detection; Anomaly detection
Current Trend and Literature on Electronic CRM Adoption Review,"Electronic Customer Relationship Management (e-CRM) is a collection of processes, concepts, and tools that allow an organization to maximize their e-business applications. The purpose of e-CRM is not only to bring about changes in the area of marketing, but also to improve the company's efficiency in managing customers, then to increase customer service, safeguard precious customers, and to help provide organizations with analytic capabilities. The various opportunities provided by e-CRM including interactive and improvised customer relationships, managing customers' touch points and personalization options, even more than that, are a powerful way to gain a competitive advantage. Computer technology including customer profiles, decision support, and data warehouses are all applicable in e-CRM, however, web and computer related development make various additional technologies applicable to e-CRM. Such as voice portals (Interactive Voice Response), bots, virtual customer representatives and web phones (IP Telephony/VoIP). This study provides an analysis and review of e-CRM and its technologies. The 14 papers are the ones that satisfied the inclusion criteria used to select systems for the study. The summary of findings shows that the latest e-CRM technology has its advantages in helping customer service and the benefits of e-CRM from various aspects such as current challenges, developments, comparison between CRM and e-CRM, benefits, impacts, customer relationship, customer satisfaction and the importance of e-CRM. The result of this survey will give future direction to potential. © Published under licence by IOP Publishing Ltd.", Competition; Data warehouses; Decision support systems; Internet telephony; Public relations; Sales; Voice/data communication systems; Competitive advantage; Computer technology; Customer relationships; Customer representative; Decision supports; E-business applications; Electronic customers; Interactive voice response; Customer satisfaction
Word embedding comparison for Indonesian language sentiment analysis,"Development of information technology makes the production of data increase dramatically. We can get lots of data from the internet, including data reviews about a product or service. The more data obtained, the system is needed to process it. Sentiment analysis is a text processing of Natural Language Processing (NLP) that can help someone to see the quality of service offered, including hotel services. This paper uses hotel review data to carry out sentiment analysis obtained from the Traveloka website. The data classified using the Long Short-Term Memory (LSTM) algorithm. To get better results, the authors use word embedding to convert words into vectors. This study aims to compare the performance of several word embedding, while word embedding compared is word2vec Continuous Bag of Words CBOW, word2vec skip-gram, doc2vec, and glove. From the experiment conducted, the results show that the glove method has the highest accuracy of 95.52% while the word2vec skip-gram model has the lowest accuracy of 91.81%, so it concluded that the glove method is the best word embedding method for hotel review data. © 2019 IEEE.",Doc2vec; GloVe; LSTM; Sentiment Analysis; Word Embedding; Word2vec Embeddings; Hotels; Long short-term memory; Quality of service; Sentiment analysis; Doc2vec; GloVe; LSTM; Word Embedding; Word2vec; Quality control
Development of a Web-Based Convergent Hospital Billing System,"Given the large volume of data generated in hospitals, the usage of hospital information system (HIS) that may ease the hospital's workload on managing patient bills is critical. Thus, this paper presents the development of a web based hospital billing system which allows the staffs to manage and store patient bills in such a way that it can integrate bills from various departments. In addition to that, the system has additional features to allow down payments, automatically generate accounting reports, as well as integrate some features of the registration and the pharmacy system. The system design followed the Waterfall approach and was done using the use case diagram, activity diagram, sequence diagram, and entity relationship diagram. The data processed was actual data from the hospital and dummy data for the pharmacy system. The system's functionality was tested using the black-box method and then evaluated by the hospital staffs using the SUS (System Usability Scale) method. From there, we obtained a score of 77.5 out of 100 from the SUS evaluation and 100% success rate from 102 features tested with the black-box testing method. Therefore, we can conclude that the new system works well and has good usability. © 2018 The Authors.", Black-box testing; Systems analysis; Telecommunication services; Testing; Websites; Black box method; Black-box testing methods; Entity relationship diagrams; Hospital information systems; Pharmacy systems; Sequence diagrams; System usability; Use case diagram; Hospitals
Adaptive Synthetic-Nominal (ADASYN-N) and Adaptive Synthetic-KNN (ADASYN-KNN) for Multiclass Imbalance Learning on Laboratory Test Data,"Annually about 1,500 cases of cervical cancer are found in Indonesia, which made Indonesia as the country with the highest number of cervical cancer cases in the world. Cervical cancer screening and HPV testing are done with a Pap smear test. However, this examination requires a lot of time, costly and highly susceptible bias of the observer during the process of investigation and analysis. To overcome these problems, several studies have modeled the machine learning with a variety of approaches have been made. However, these studies are constrained by the limitation of the data amounts and the imbalanced data that caused by the different ratio of each case. This can lead to errors in the classification of the minority due to the tendency of the classification results that focus on the majority class. This study addressed the handling imbalance data on classification of cases Pap test results using the method of over-sampling. ADASYN-N and ADASYN-KNN algorithms were proposed as a development of ADASYN algorithm to handle datasets with nominal data types. This study included SMOTE-N algorithm to deal with the problem as comparison algorithm. As the results, ADASYN-KNN with the preference '0' gave the highest accuracy, precision, recall, and f-score of 95.38%; 95.583%; 95.383%; and 95.283%. The highest ROC area value was obtained with the ADASYN-KNN with preference '1' of 99.183%. © 2018 IEEE.",ADASYN; cervical cancer; imbalance class; nominal; over-sampling; Pap smear; SMOTE-N Diseases; Learning systems; ADASYN; Cervical cancers; imbalance class; nominal; Over sampling; Pap smear; Data handling
Analysis distribution of traders and population density using exploratory spatial data analysis (case: Dharmasraya district of west sumatera province),"Population is one of the main factors that impact the growth of trader in one region, as well as Dharmasraya, a city near the province of west sumatera. The population in Dharmasraya continues to increase with growth rate around 2.78% per year until 2016, therefore the government need to concern a methods to monitor the spread of traders and residents. The aim of this paper is to present spatial analysis to analyze the distribution of traders and population. Spatial analysis data requiring Exploratory Spatial Data Analysis (ESDA) to see the patterns of population density and traders, spatial analysis assumes the spatial correlations between regions as a research objects. The distribution of traders and population in a sub-districts will be affecting the other sub-districts. In order to find out the relationship between traders and the population, this research will be using Spatial Lag Autocorrelation and spatial error autocorrelation to determine spatial interaction, and also by using Univariate Moran I for global spatial autocorrelation. Methods based on administrative boundaries are added to this analysis as a matrix weight for comparison with existing methods in ESDA tools. The results of spatial exploration in population density data and the traders in Dharmasraya resulting in some spatial grouping. The spread of population and traders in 2016 is significantly positive, meaning that there is a similarity of values from adjacent and clustered locations. Thus, this paper is able to contribute to the government of Dharmasraya in monitoring the spread of population and traders. © 2018 IEEE.",Dharmasraya; ESDA; Global spatial autocorrelation; Spatial autocorrelation; Spatial autoregressive models Autocorrelation; Commerce; Data handling; Information analysis; Intelligent systems; Population distribution; Population dynamics; Population statistics; Auto regressive models; Dharmasraya; ESDA; Exploratory spatial data analysis; Population densities; Spatial autocorrelations; Spatial correlations; Spatial explorations; Spatial variables measurement
Predicting the amount of digestive enzymes medicine usage with LSTM,"Medicines are widely used to prevent or cure illness. One of the medicines, which often used to relieve stomach pain, is a medicine that contains digestive enzymes. Hospitals and other health institutions much need this type of medicines. Hospitals and other health institutions should ensure the availability of medications for patients. This situation forces health institutions to deal with the uncertainty of medicine usage. Hospitals as one of the health institutions have some challenges. One of the challenges that must be faced is to ensure the availability of medicines for patients. The ability to predict can help ensure medicines availability in hospital. In this study will presents the forecasting model using Long Term Short Memory (LSTM) method to predict the need for medicines that contain digestive enzymes in the hospital. This method is chosen because it is known to have high accuracy to predict stationary data. One of the methods used in input identification for the LSTM method is by using the Autocorrelation Function (ACF) and Partial Autocorrelation Function (PACF). The results of this study indicate that the use of LSTM method suitable for time series forecasting in the historical dataset, with 12.733 Root Mean Square Error (RMSE) value. © International Journal on Advanced Science Engineering Information Technology.",Digestive enzymes; Forecasting; LSTM; Medicine; Medicine usage 
Combat aircraft effectiveness assessment using hybrid multi-criteria decision making methodology,"Selection of military defense equipment, especially combat aircraft appropriately, effectively and efficiently affects to the readiness of the Indonesian Air Force in upholding the country's sovereignty in the air. Based on the problems, the military requires an application that can support decision-making for the electoral system Combat Aircraft. This paper presents a decision support system using MCDM method with a combination of methods Analytic Hierarchy Process (AHP) and Method Techniques For Preference Order By Similarity (TOPSIS).The methods use an experimental design technique to assign weights attributes and then the operating methods for building models of decision making. As an illustration of this model using six examples of anaircraft type that are still in operation this era with 6 kinds of criteria which determine in air to air dogfight. By using the MCDM method will generate preference value to rank each alternative type of aircraft. © 2016 IEEE.",AHP; MCDM; TOPSIS Analytic hierarchy process; Artificial intelligence; Decision support systems; Fighter aircraft; Hierarchical systems; Analytic hierarchy process (ahp); Effectiveness assessment; Electoral systems; Experimental design techniques; MCDM; Multi criteria decision making; Preference order; TOPSIS; Decision making
State of charge estimation of Lithium Polymer battery using ANFIS and IT2FLS,"in this research, the estimation method using IT2FLS (Interval Type 2 Fuzzy Logic System) and ANFIS (Adaptive Neuro-Fuzzy Inference System) as a base to build the membership functions and the rule base is constructed. The differences area of uncertainty is used to determine a model of type 2 fuzzy systems based on the smallest RMSE value. This study uses two methods of type-reducer, namely Enhanced Iterative Algorithm with Stop Condition (EIASC) and Enhanced Opposite Direction Search (EODS) to determine the most appropriate capacity estimation of the battery. Two types of datasets are used to determine the method performance indicated by MSE, RMSE and MAE. Based on the tests performed in three methods: T1FLS, IT2FLS EIASC, and IT2FLS EODS, it has been found that IT2FLS produces the smallest RMSE value with the RMSE value of 3.3% for static discharge dataset and 5.9% for pulse variation dataset. © 2016 IEEE.",Battery; BMS; Fuzzy; IT2FLS; SOC Charging (batteries); Electric batteries; Fuzzy inference; Fuzzy logic; Fuzzy neural networks; Fuzzy systems; Iterative methods; Lithium-ion batteries; Membership functions; Secondary batteries; Statistical tests; System-on-chip; ANFIS (adaptive neuro fuzzy inference system); Battery; Fuzzy; Interval type-2 fuzzy logic systems; IT2FLS; Iterative algorithm; State-of-charge estimation; Type-2 fuzzy systems; Battery management systems
Development of semi-supervised named entity recognition to discover new tourism places,"Tourism information needs are increasing in line with tourism that has been a primary need for some people. This has an impact on the growth of the tourism information provider. The amount of available information sometimes makes tourist confuse to the information that they needed. Currently, the search systems only rely on indexing web pages so that the information obtained by the tourist is still unfavorable because it only shows a web page with keywords that exist on the article. A support system to recognize tourism places on the web pages is required to produce better information presentation. In this study, the recognition system based on Yet Another Two Stage Idea (YATSI) Semi-Supervised Learning with the Naïve Bayes classifier is used to address the problem. Results obtained by classifying candidate entities on a hundred web pages demonstrate 74% precision with 70% recall. © 2016 IEEE.",information retrieval; machine learning; named entity recognition; naïve bayes; semi-supervised learning; tourism destinations Information retrieval; Learning algorithms; Learning systems; Supervised learning; Web crawler; Websites; Bayes Classifier; Information presentation; Information provider; Named entity recognition; Recognition systems; Semi- supervised learning; Semi-supervised; tourism destinations; Search engines
ARIMA implementation to predict the amount of antiseptic medicine usage in veterinary hospital,"The medicine is a tool for patients either human or animal to treat or prevent disease. One of the medicines which often used to help prevent infections is an antiseptic medicine. Povidone-iodine is an antiseptic and disinfectant medicine that is extensively used by hospital and other health care. A health care institution such as pharmacies or hospitals must ensure the availability of medicines for patients. These things make the pharmaceutical dealing with the uncertainty of the medicine needed. Veterinary hospital as a health service provider has several challenges. One of the challenges is it must ensure the availability of the medicine needed at all time. The predictive capability of the amount of medicine usage can assist for managing the availability of medicines in veterinary hospitals. This study analyses and presents a forecasting model using ARIMA method to predict an antiseptic povidone-iodine usage at Prof. Soeparwi Veterinary Hospital. ARIMA method was selected because the method can be used in fitting forecasting models when there is a non-stationary time series and the method has capability to correct for local trend in data. Results of this study is ARIMA (1,0,1) was selected as a suitable model to represent historical dataset. © 2016 IEEE.",ARIMA; Forecasting; Medicine; Veterinary hospital Biomedical engineering; Forecasting; Health care; Hospitals; Iodine; ARIMA; Forecasting modeling; Forecasting models; Health services; Historical dataset; Non-stationary time series; Predictive capabilities; Veterinary hospitals; Medicine
Pattern of accesibility level of health facilities in yogyakarta,"Regional development programs in the regional autonomy policy require the smallest area unit information. One of those programs is the construction of health facilities. The process of health development in the future requires the pattern of distribution of health facilities that already exists today. Distribution of health facilities in the province of Yogyakarta is still concentrated in urban areas, and the number of health facilities is not comparable with the area of each district. Therefore spatial data analysis using Exploratory Spatial Data Analysis (ESDA) is needed in order to see the pattern of accessibility level of existing health facilities. Spatial analysis considers the spatial correlation among the regions as the object of research. The existence of health facilities in a village will influence the accessibility to health facilities in another village. This paper uses health facilities index to find spatial clusters of accessibility level. New method based on administrative boundaries is added to this analysis as weights matrix to be compared with existing methods in GeoDa tools. The experiments show the use of weights matrix by administrative boundaries gives the best result. This weighing has the highest Moran's I, so it is more suitable weighing method for this analysis. Furthermore, the spatial clustering of the easiest access to health facilities occurs in the urban areas and some area around them, such as in Yogyakarta City and Sleman Regency near Yogyakarta City, also in central government area. © 2016 IEEE.",Cluster; Exploratory spatial data analysis; Health facilities; Health facility index; Yogyakarta Biomedical engineering; Data handling; Health; Information analysis; Matrix algebra; Regional planning; Rural areas; Spatial variables measurement; Transportation; Weighing; Central government; Cluster; Exploratory spatial data analysis; Health facilities; Regional development; Spatial correlations; Spatial data analysis; Yogyakarta; Facilities
Comparative study on data mining classification methods for cervical cancer prediction using pap smear results,"The number of woman with cervical cancer in Indonesia is getting higher. Indonesia becomes the country with the highest number of women with cervical cancer in the world. Cervical cancer became the highest cause of cancer deaths in women globally. There has been a lot of research using data mining techniques with variety of different data mining models that can be used for analyzing cervical cancer. In this research, data that be used were obtained from the medical records of the Pap smear test results. There are 38 symptoms and 7 classes. Naïve Bayes, Support Vector Machines (SVM), and Random Forest Tree was used to evaluate the performance of the classifier. The performance matric that used in this study are accuracy, recall, precision, and ROC curve. Based on the performance matric, Random Forest Tree is the best classifier among other classifiers to classify Pap smear results. © 2016 IEEE.",Cervical cancer; Classification; Data mining; Naïve bayes classifier; Pap smear; Random forest tree; Support vector machines Biomedical engineering; Data mining; Decision trees; Diseases; Forestry; Sodium; Support vector machines; Bayes Classifier; Cervical cancers; Comparative studies; Data mining models; Medical record; Mining classification; Pap smear; Random forests; Classification (of information)
Learning Performance Prediction with Imbalanced Virtual Learning Environment Students’ Interactions Data,"One of the critical aspects in completing study in a virtual learning environment (VLE) is the student behavior when interacting with the system. However, in real cases, most of the student behavior data have imbalanced label distribution. This imbalanced dataset affects the model performance of machine learning algorithms significantly. This study attempts to examine several resampling methods such as random undersampling (RUS), oversampling with synthetic minority oversampling technique (SMOTE), and hybrid sampling (SMOTEENN) to resolve the imbalanced data issue. Several machine learning (ML) classifiers are employed to evaluate the efficiency of the resampling methods, including Naïve Bayes (NB), Logistic Regression (LR), and Random Forest (RF). The experiment results indicate that the performance of classifiers is improved utilizing more balanced dataset. Furthermore, the Random Forest classifier has accomplished the best result among all other models while using SMOTEENN as a resampling approach. © 2022, The Author(s), under exclusive license to Springer Nature Switzerland AG.", 
