Physical discomfort and eye movements during arbitrary and optical flow-like motions in stereo 3D contents,"Users of stereo 3D technology commonly report physical discomfort during or after exposure of stereo 3D contents. The discomfort has been associated with sensation of arbitrary and optical flow-like self-motion. However, there is no information on whether arbitrary motion induces stronger physical discomfort compared with optical flow-like motion. To address this research gap, we investigate physical discomfort among players and spectators of stereo 3D contents using eye tracking and Simulator Sickness Questionnaire. Thirty participants (N= 30) acted as players and spectators of a first-person shooter (FPS) and a car racing game. The FPS and the car racing game produce a sensation of arbitrary and optical flow-like self-motion, respectively. Experimental results show that the FPS game induces more severe physical discomfort than its racing counterpart (p< 0.0083 , with a Bonferroni correction to the p value). We also found that severeness of oculomotor symptoms can be predicted using two eye movements metrics: the amount of fixational eye movements and viewing duration at the center of the screen. Our study implies that one should pay particular attention to different types of self-motion in stereo 3D contents regardless of whether the user controls or solely watches the contents. Our study also suggests that physical discomfort can be reduced by decreasing the frequency of fixational eye movements while prolonging the duration of each fixation at the center of screen. © 2019, Springer-Verlag London Ltd., part of Springer Nature.",Cybersickness; Eye tracking; Human factors in virtual reality; Stereo 3D Eye tracking; Optical flows; Racing automobiles; Virtual reality; 3D technology; Bonferroni correction; Cybersickness; First person shooter; Fixational eye movements; Self motion; Simulator sickness; User control; Eye movements
A Proposed user requirements document for children's learning application,"User requirements are the highest level of requirements. Flawed user requirements document can cause defects in the software being built-aspects of applications that were not presented in the user requirements document to cause a defect. In learning applications for children, there are aspects of pedagogy that need to be well documented. This aspect is not available in the general user requirements document, so it is often not well presented. The learning style and thinking skills level is crucial to be well presented in the user requirements document. That was because the children's persona cannot be compared at every range criteria of developmental age. That factor will undoubtedly affect the specifications of the software to be built. Users' viewpoints about different requirements can also make developers wrong in determining requirements. Applying requirements prioritization in the user requirements document can help resolve the problem. Measurement of document quality was also performed using parameters in measuring the quality of the user requirements document. The results of measuring the quality of the user requirements document found that it is reliable for use. © 2020, Science and Information Organization.",Aspect of pedagogy children; Learning application; User requirements; User requirements document Application programs; Computer aided instruction; Aspect of pedagogy child; Children learning; Learning application; Learningstyles; Requirements document; Skill levels; Thinking skills; User requirement document; User requirements; Defects
Identification of children learning styles using elicitation application,"Learning styles is one aspect of pedagogy that needs to be considered in the learning process. Understanding of material will be achieved if it is by the learning styles. Children do not have experience in the learning process, so identification of children learning styles is needed. The cognitive, psycho-motor and emotional abilities of children in each varying age range become a factor that determines learning styles. Learning styles tend to be recommended to children in the form of visual, audio, read/write and kinesthetic. Identification can be made towards learning styles that are by the child's preferences. The use of digital applications will be more accurate when compared to questionnaires in identifying learning styles. The presentation of interactive material and immersive in each learning styles can help identify children's learning styles. The assessment of material understanding was clarified in elicitation apps. The material evaluation was presented in the form of a set of questions related to the material presented. Interactions in the evaluation activities in the apps were presented according to the child's learning styles. Output produced by the application can be used by learning application developers, teachers, or parents in identifying children's learning styles. © 2020 Mira Kania Sabariah, Paulus Insap Santosa and Ridi Ferdiana.",Children; Children's learning styles; Learning process; Learning styles 
Model of tools for requirements elicitation process for children's learning applications,"Requirements Elicitation are the initial stages in the application development process, where a set of needs from the system will be built and obtained by communicating with stakeholders who have a direct and indirect influence on those needs. Failure in the requirements elicitation process was caused by weak communication. Communication is an essential thing in carrying out the requirements elicitation process. The selection of the right elicitation technique is not only a solution. Informants as sources of information on requirements also need to be considered. The choice of the correct technique often fails because of the tools not useful. The availability of the right form of equipment needs to be considered so that the communication between the elicitation team and the informant goes well. Children have characteristics not the same as adults. Limitations in terms of psychomotor, cognitive, and emotional children are considered in choosing elicitation techniques and tools. These limitations are also influenced by the age range of child development. The use of digital elicitation devices is recommended to be used in the requirements elicitation process. The presentation of interactive tools makes it easier for children to convey their desires. In learning applications for children, aspects of pedagogy that need to be explored are learning styles and children's thinking abilities. Every child in every age range has a different preference for learning style. That is because children do not have learning experiences. That also applies to the level of thinking ability of children. Therefore, these two things need to be appropriately explored when the learning application development process. The proposed elicitation tool model was made by taking into account both components of that pedagogical aspects. The test results of the built model show that the application has satisfaction. That means that children can communicate well in conveying the needed as requirements to the learning application. © 2020, Science and Information Organization.",Children learning application; Communication; Learning style; Pedagogical aspect; Requirements elicitation Computer aided instruction; Digital devices; Learning systems; Application development process; Child learning application; Children learning; Elicitation techniques; Learningstyles; Pedagogical aspects; Psychomotors; Requirements elicitation; Sources of informations; Techniques and tools; Requirements engineering
Towards a lightweight detection system for cyber attacks in the IoT environment using corresponding features,"The application of a large number of Internet of Things (IoT) devices makes our life more convenient and industries more efficient. However, it also makes cyber-attacks much easier to occur because so many IoT devices are deployed and most of them do not have enough resources (i.e., computation and storage capacity) to carry out ordinary intrusion detection systems (IDSs). In this study, a lightweight machine learning-based IDS using a new feature selection algorithm is designed and implemented on Raspberry Pi, and its performance is verified using a public dataset collected from an IoT environment. To make the system lightweight, we propose a new algorithm for feature selection, called the correlated-set thresholding on gain-ratio (CST-GR) algorithm, to select really necessary features. Because the feature selection is conducted on three specific kinds of cyber-attacks, the number of selected features can be significantly reduced, which makes the classifiers very small and fast. Thus, our detection system is lightweight enough to be implemented and carried out in a Raspberry Pi system. More importantly, as the really necessary features corresponding to each kind of attack are exploited, good detection performance can be expected. The performance of our proposal is examined in detail with different machine learning algorithms, in order to learn which of them is the best option for our system. The experiment results indicate that the new feature selection algorithm can select only very few features for each kind of attack. Thus, the detection system is lightweight enough to be implemented in the Raspberry Pi environment with almost no sacrifice on detection performance. © 2020 by the authors. Licensee MDPI, Basel, Switzerland.",DDoS attack; Feature selection; IDS; IoT; Machine learning; Raspberry Pi 
Implementing Lightweight IoT-IDS on Raspberry Pi Using Correlation-Based Feature Selection and Its Performance Evaluation,"The application of many IoT devices is making our world more convenient and efficient. However, it also makes a large number of cyber-attacks possible because most IoT devices have very limited resources and cannot perform ordinary intrusion detection systems. How to implement efficient and lightweight IDS in IoT environments is a critically important and challenging task. Several detection systems have been implemented on Raspberry Pi, but most of them are signature-based and only allow limited rules. In this study, a lightweight IDS based on machine learning is implemented on a Raspberry Pi. To make the system lightweight, a correlation-based feature selection algorithm is applied to significantly reduce the number of features and a lightweight classifier is utilized. The performance of our system is examined in detail and the experimental result indicates that our system is lightweight and has a much higher detection speed with almost no sacrifice of detection accuracy. © 2020, Springer Nature Switzerland AG.", Computer crime; Internet of things; Intrusion detection; Learning systems; Network security; Cyber-attacks; Detection accuracy; Detection speed; Detection system; Feature selection algorithm; Intrusion Detection Systems; On-machines; Feature extraction
Improving Confusion-State Classifier Model Using XGBoost and Tree-Structured Parzen Estimator,"Detecting confusion has been considered as a critical issue in online education platforms. Confusion emerged as an effect of the limited interaction between lecturers and learners. The confusion detection machine learning model can be used to overcome the problem. Such a model can provide the ability for online education systems to detect confusion, thus it can react accordingly. Encouraged by the need, several studies have been done to develop confusion-state classifier models. The best previous model has an average accuracy of 75%. Despite having a promising result, the model still contains several gaps that can be improved. The gaps lie in the selection of the machine learning algorithm and the absence of any hyper-parameter optimization technique. This study aims to overcome them using two approaches: replacing the machine learning algorithm with XGBoost and applying the Tree-structured Parzen Estimator (TPE) as a hyper-parameter optimization technique. The TPE was also combined with the Recursive Feature Elimination (RFE) technique. The proposed model had outperformed the previous ones by achieving an average accuracy of 87%. This study also brought out the most optimal configuration of features and hyper-parameters to build such a model. This study had presented the current confusion-state classifier model. © 2019 IEEE.",classifier; confusion; hyper-parameter optimization; Tree-Structured Parzen Estimator; XGBoost E-learning; Forestry; Intelligent systems; Machine learning; Online systems; Parameter estimation; Trees (mathematics); Classifier models; Critical issues; Hyper-parameter; Hyper-parameter optimizations; Machine learning models; On-line education; Parzen estimators; Recursive feature elimination; Learning algorithms
Predicting Student Academic Performance using Machine Learning and Time Management Skill Data,"Prediction of student academic performance is an important aspect in the learning process. This study applies several machine learning models in predicting student academic performance using Time Management Skills data obtained from Time Structure Questionnaire (TSQ). Previously, some other data has been used as a feature in making predictions, but TSQ result had never been used before as a feature, even though it may shows the conditions of how students use their time in learning. Five different machine learning models were trained using TSQ data to predict student academic performance. In addition, student English performance is also predicted in the same way as a comparison As a result, the Linear Support Vector Machine model can predict student academic performance with 80% accuracy and English performance with 84% accuracy using TSQ data. © 2019 IEEE.",Academic Performance; Classification; Machine Learning; Prediction; Time Management Skills Forecasting; Information management; Intelligent systems; Learning systems; Support vector machines; Academic performance; Learning process; Linear Support Vector Machines; Machine learning models; Time management; Students
Conceptual Model for Human Anatomy Learning Based Augmented Reality on Marker Puzzle 3D Printing,"Learning medicine not only requires students to master a variety of abilities but also must follow some doctoral standards. In general, the learning process within the Faculty of Medicine students is still conducted by using cadaver. However, several obstacles were encountered when using that media. To overcome the limitations, the use of Augmented Reality (AR) technology has become a medium used for learning. A systematic review method of the study and research of human anatomy on AR in the field of medicine is presented. Based on this review, a model for developing human anatomy learning media using AR that uses 3D printing object marker puzzles was created. The concept model is expected to be able to overcome some of the problems. Potential challenges in developing human anatomy learning models using 3D printing puzzle markers present more specific information and location of a part of human anatomy. © 2019 IEEE.",human anatomy; human anatomy learning; marker puzzle 3D printing; skeleton; sugmented reality Augmented reality; Learning systems; 3-D printing; Conceptual model; Human anatomy; Learning process; skeleton; Specific information; sugmented reality; Systematic Review; 3D printers
MUCPSO: A Modified Chaotic Particle Swarm Optimization with Uniform Initialization for Optimizing Software Effort Estimation,"Particle Swarm Optimization is a metaheuristic optimization algorithm widely used across a broad range of applications. The algorithm has certain primary advantages such as its ease of implementation, high convergence accuracy, and fast convergence speed. Nevertheless, since its origin in 1995, Particle swarm optimization still suffers from two primary shortcomings, i.e., premature convergence and easy trapping in local optima. Therefore, this study proposes modified chaotic particle swarm optimization with uniform particle initialization to enhance the comprehensive performance of standard particle swarm optimization by introducing three additional schemes. Firstly, the initialized swarm is generated through a uniform approach. Secondly, replacing the linear inertia weight by introducing the nonlinear chaotic inertia weight map. Thirdly, by applying a personal learning strategy to enhance the global and local search to avoid trap in local optima. The proposed algorithm is examined and compared with standard particle swarm optimization, two recent particle swarm optimization variants, and a natureinspired algorithm using three software effort estimation methods as benchmark functions: Use case points, COCOMO, and Agile. Detailed investigations prove that the proposed schemes work well to develop the proposed algorithm in an exploitative manner, which is created by a uniform particle initialization and avoids being trapped on the local optimum solution in an explorative manner and is generated by a personal learning strategy and chaotic‐based inertia weight. © 2022 by the authors.",Chaotic inertia weight; Particle swarm optimization; Personal learning strategy; Software effort estimation; Uniform particle initialization 
Categories for barriers to digital transformation in higher education: An analysis based on literature,"For higher education institutions that encourage digital transformation, understanding the barriers are necessary for the digital transformation accomplishment. The purpose of this paper is to present a review of the literature on barriers to digital transformation in higher education. To get a wide overview in identifying the barriers to the implementation of digital transformation, a structured literature review was used to select the relevant studies published. Nine categories were identified based on the literature reviewed: vision, strategy and policy, resources, leadership, digital skill and knowledge, technology, adaptability, resistance to change, and government and economic. Our findings provided a fish-bone diagram that outlines twenty-two barriers to digital transformation in higher education. The main contribution of this study is a synthesis of the state of the art of barriers to digital transformation in higher education. We contribute to provide a common basic understanding of barriers to digital transformation in higher education to overcome barriers for improving the possibility of success. Moreover, we give an insight into future research on barriers exploration in the context of digital transformation in higher education. © 2021, International Journal of Information and Education Technology. All rights reserved.",Barriers framework; Digital innovation; Digital technology; Digital transformation; Higher education; Policymakers 
Cat sounds classification with convolutional neural network,"In this study, we attempt to use a convolutional neural network (CNN) to identify cats’ different sounds. CNN is proven to classify different patterns from the spectro-temporal features of a sound and thus well suited for sound classification. We will perform data transformation using mel-frequency cepstral coefficients (MFCCs) to extract the sound frequency to apply this method. In MFCCs, each frequency bin is quasi-logarithmically spaced so that it resembles the resolution of the human auditory system compared to the spectrogram. We will be using four convolutional layers of CNN architecture with a pooling layer and dense layer as the output layer in our model. From the sound ontology Audio set, we can collect 595 different sound data classified into five categories of cat sounds, which we used to train our model. From our training process, our model can achieve a classification accuracy of 88.473254%. In the future, we look forward to improving our model accuracy by adding more data and even out each label to reduce overfitting. We would also like to implement a data augmentation method on our dataset to improve our model accuracy. © 2021, School of Electrical Engineering and Informatics. All rights reserved.",Convolutional Neural Network (CNN); Deep learning; Mel-frequency cepstral coefficients (MFCCs); Sound classification 
Developer's Perspectives on Unit Test Cases Understandability,"Good unit testing plays the most important role when it comes to driving and evaluating software quality. However, writing effective tests is a very expensive and time-consuming practice. To reduce such load on developers, there are many different techniques for automatically generating test suites for an existing source code. However, how automatically generated test cases compare to manually written cases is an open research question. There are some understandability issues regarding autogenerated test cases. This paper presents an experiment based on A/B testing methodology to gather developer preferences at test cases presentation. This survey involved 44 developers from 17 country. It founds that majority developers prefer the manual written than automatic generated test cases. This result brings some new perspectives to improve the quality of the automatic generated test case. © 2021 IEEE.",automatic generation; readability; test case; understandability Computer software selection and evaluation; Software quality; Software testing; A/b testing; Automatically generated; Evaluating software; Research questions; Source codes; Understandability; Unit testing; Unit tests; Automatic test pattern generation
Gaze-Controlled Digital Signage for Public Health Education during Covid-19 Pandemic,"For more than a decade, digital signages have been used in health facilities and public environment to provide fun and interactive approach of education. Unfortunately, interacting with conventional digital signage during Covid-19 pandemic raises a concern on its hygiene. Thus, touchless interaction is preferable to avoid direct contact on the touch screen. Here we present a novel study on effectiveness of gaze-based interaction in a digital signage for public health education. Instead of touching the screen, the users engage with the content by gazing at a dynamic button that moves in horizontal or vertical direction. Experimental results show that gazing at faster dynamic buttons (angular speed of 60.28°/s) than its slower counterpart (angular speed of 30.14°/s) requires shorter time to complete a three-steps task (T = 84, Z =-1.977, p < 0.05). Our study provides a scientific proof of concept for further development of touchless digital signage that complies with health protocols of the World Health Organization during Covid-19 pandemic. © 2021 IEEE.",digital signage; Eye tracking; gaze interaction; touchless technology Fasteners; Public health; Touch screens; Gaze-based interaction; Health education; Health facilities; Interactive approach; Proof of concept; Public environment; Vertical direction; World Health Organization; E-learning
Barriers to Digital Transformation in Higher Education: An Interpretive Structural Modeling Approach,This paper presents a study of developing a framework using Interpretive Structural Modeling (ISM) for the barriers to digital transformation in higher education in a particular context: Indonesia. This study has identified 55 contextual relationships between the 11 key barriers and has developed five levels of the structure hierarchy. This study also proposed a four-phase strategy that will guide us to improve the strategy of the implementation of digital transformation in higher education in Indonesia. This research gives contribution by providing a better understanding of barriers and the interrelationships among barriers in the implementation of the digital transformation in the higher education domain. © 2021 World Scientific Publishing Company.,Digital transformation; higher education; interpretive structural modeling 
Digital Transformation in Higher Education: A Barrier Framework,"The purpose of this study is to highlight the barriers which need to be considered when implementing digital transformation in higher education based on literature and real case. First, a systematic literature review on the barriers to digital transformation in higher education was conducted to identify the barriers. Second, to categorize the findings of the literature review, this study implemented a reference barrier model which consists of four categories (contextual barrier, social barrier, technical barrier, and cultural barrier). Finally, an exploratory case study in the specific context of digital transformation in higher education was carried out to validate the contextualized barrier framework. This study provided a contextualization barrier framework that outlines 22 barriers. Through an evaluation, the relevance level of all barriers was assessed and obtained between 2.88 and 4.00 (scale of 1-5), which means that the finding of the literature review in this study was valid and able to capture the real situations. The result of this research can give a framework for further research in the effort to minimize the effect of each barrier. In addition, the proposed framework was an initial step to standardize the description of barriers and could be used as a starting point to the effectiveness of the formulation of strategies and policies that will be applied. © 2021 ACM.",Barrier framework; Digital transformation; Higher education Barrier framework; Barrier model; Contextualization; Digital transformation; Exploratory case studies; High educations; Real case; Systematic literature review; Technical barriers; E-learning
