Sentiment analysis on product review using support vector machine (SVM),"Public opinion can influence an organization or a company profile. It is important for the company to evaluate public response regarding their products. However, monitoring and organizing of public opinion are not easy. There are many published opinions in social media that is difficult to be processed manually. Therefore, a technique for automatically categorizing public reviews into positive or negative is needed. This research examined the classification of user reviews on products Windows Phone by implementing Support Vector Machine (SVM). This study used four different methods in tokenization stage: unigram, bigram, trigram, and n-gram. In the preprocessing data, there were 8 experiments whereas each group implemented 2 stemming algorithms (Snowball Stemmer and Iterated-Lovin Stemmer). The results were used as input of classification. Each input was classified 3 times with values C 0.25, 0.5, and 1.0. In conclusion, the result yielded the most appropriate model from n-gram with algorithm Iterated-Lovin Stemmer and C value 1.0. Finally, the use of SVM proves to be feasible approach of sentiment analysis regarding specific product. © 2019 IEEE.",Bigram; N-gram; Sentiment analysis; Support vector machine; Trigram; Unigram Sentiment analysis; Social aspects; Appropriate models; Company profile; Product reviews; Public opinions; Public review; Stemming algorithms; Tokenization; Windows phones; Support vector machines
What is informatics education students’impression of using metacognitive training system at the first time?,"The use of Metacognitive Training System (MTS) is relatively new in Indonesia. Previously, a prototype of MTS has been developed and applied in Universitas Gadjah Mada. To become a massive product, the prototype of the MTS must be tested on a larger scale. It is intended to capture user impression about a new product. In this paper, we present User Experience (UX) measurement for the developed MTS in larger scale, involving 90 undergraduate students of informatics education at Universitas Negeri Malang. Two UX measurement methods are used, including User Experience Questionnaires (UEQ) and short-interview. UEQ is used for capturing general impressions, whereas, short-interview is conducted to get deeper feedback about the efficacy of the MTS in their studies. The UX measurement result is benchmarked and revealed that Attractiveness, Efficiency, and Stimulation categorized excellent and the interview result shows that more than 75% respondent responds with the positive answer in five questions. With this result, it could be concluded that the MTS is ready for massive product. © 2018 IEEE.",Metacognitive training system; Student impression; User experience Informatics; Information systems; Information use; Surveys; Indonesia; Informatics education; Measurement methods; Metacognitives; Training Systems; Undergraduate students; User experience; User experiences (ux); Students
User-centered design on metacognitive training system: A case in algorithm and data structure course,"Metacognitive training system (MTS) is a computer-based learning system aimed at developing students' metacognition. Metacognition is needed to develop students' self-regulation which is required for learning complex topics such as algorithm and data structure (ADS). Previously, we develop an MTS to support algorithm-learning. However, the approach tends to be technology-centered, thus, producing low usability score. Therefore, this paper proposes an incorporation of user-centered design (UCD) into the development of the MTS to produce a more usable system. As a result, new information architecture, wireframe, and user interface design are obtained. Finally, the system usability testing is conducted to compare two versions of the MTS, i.e. older and newer version. The result shows that the newer version has higher usability scale. In addition, the newer version of the MTS shows a positive impact on a real learning situation, indicated by the significant difference on students' performance between control and experiment group. © 2018 IEEE.",Algorithm and data structure; Metacognitive training system; User interface design; User-centered design Cognitive systems; Curricula; Data structures; Learning algorithms; Software design; Students; User centered design; Algorithm learning; Computer-based learning systems; Information architectures; Learning situation; Students' performance; Training Systems; User Centered Design(UCD); User interface designs; User interfaces
A Framework for Improving Recommendation in Adaptive Metacognitive Scaffolding,"Metacognitive scaffolding is an important pedagogical support to encourage self-regulated learning, especially in computer-based learning environments. Currently, an e-learning system which is complemented by metacognitive scaffolding has been developed. The scaffolding includes a recommendation system given by a virtual pedagogical agent. However, an academic satisfaction evaluation on the system reveals that the recommendation is less helpful. Therefore, this paper proposes a framework for providing a better recommendation. Two types of recommendations are aimed, including recommendation for the definition of learning goal/sub-goal and learning strategy. Goal/sub-goal recommendation is generated by identifying students' level of prior knowledge by using text classification algorithm. On the other hand, the strategy-use recommendation is generated by modeling the fitness of previously used learning strategy using fuzzy inference system and analyzing students' interaction log with the learning strategy. Implementation of the proposed scheme produces a prototype of the recommendation system. An A/B testing is conducted to compare previous and newer recommendation systems. The test shows that most of the users prefer to use the improved recommendation system. © 2018 IEEE.",algorithm learning; fuzzy inference system; metacognitive scaffolding; recommendation; student modeling Classification (of information); Computer aided instruction; E-learning; Fuzzy inference; Fuzzy systems; Inference engines; Learning systems; Scaffolds; Students; Text processing; Algorithm learning; Fuzzy inference systems; Metacognitive scaffoldings; recommendation; Student Modeling; Recommender systems
Tahani model of fuzzy database for an adaptive metacognitive scaffolding in Hypermedia Learning Environment (Case: Algorithm and structure data course),"Studies show that an adaptive learning environment is needed by learners. Adaptive e-learning systems have been developed with personalized instructions based on student's knowledge level. Since each student has a unique cognitive and metacognitive level, we currently develop an adaptive Hypermedia Learning Environment (HLE) for Algorithm and Data Structure Course based on a metacognitive awareness level. HLE provides adaptive scaffolding as instructional interventions to facilitate students' aptitude in programming. Scaffolding can be determined by knowing student's metacognitive awareness level. In this research, we propose the use of Tahani Model of Fuzzy Database in web-based HLE to support the adaptive decision-making. Tahani is one of some feasible models in a fuzzy database that can categorize students' metacognitive awareness level. The produced fuzzy rules have been validated by metacognitive experts of educational psychology. A hundred students have been categorized into three groups (low, medium, high) and provided with appropriate scaffolding. Evaluation results verified the suitability of the proposed method and the student's scaffolding. © 2017 IEEE.",adaptive; e-learning; fuzzy database; metacognitive; scaffolding; Tahani model Adaptive systems; Database systems; Decision making; E-learning; Fuzzy inference; Hypermedia systems; Learning algorithms; Learning systems; Scaffolds; Students; Sustainable development; adaptive; Adaptive e-learning systems; Adaptive hypermedia learning; Adaptive learning environment; Fuzzy database; Hypermedia learning environments; Metacognitives; scaffolding; Computer aided instruction
Heuristic evaluation and user testing with ISO 9126 in evaluating of decision support system for recommendation of outstanding marketing officer,"Multi-Criteria Decision Making in implementation of the Decision Support System (DSS) at BRI Katamso Yogyakarta helps decision makers in providing alternative decisions to choose the outstanding marketing office (MO) with DSS process. After implementation DSS in BRI Katamso, the next step is to evaluate the DSS. The purpose of this paper is to evaluate the DSS by using heuristic evaluation and ISO 9126. Evaluation is needed to test whether the system as expected. An evaluation of the designed system is expected to answer if any problems and improve goal attainment. ISO 9126 works to determine the level of effectiveness, efficiency, satisfaction. Heuristic Evaluation have function to evaluate the User Interface of DSS. Based on the ISO and heuristic evaluation, the general design of the interface and some of the factors effectiveness, efficiency, satisfaction vielded the average value of 3.75 (on a scale of 5). © 2017 IEEE.",BRI Katamso; DSS; Heuristic Evaluation; ISO 9126; Marketing Officer Artificial intelligence; Commerce; Decision making; Efficiency; Marketing; User interfaces; BRI Katamso; Decision makers; Decision support system (dss); General designs; Goal attainment; Heuristic evaluation; Iso 9126; Multi criteria decision making; Decision support systems
Enhancing student clustering to generate adaptive metacognitive instructions in learning system for vocational high school,"Adaptivity in learning systems depends on accuracy of learner modelling. Specifically, for generating cluster-based instructions, quality of student clustering is critical. Studies on student clustering are abundant; however, a system for clustering metacognitive that considers proper analysis technique of Likert-scaled dataset is unavailable. This article proposes a student clustering method which uses a new Likert scale analysis. It is performed on a dataset collected from 81 students of a vocational high school. The performance was compared to previous methods; enhancement is shown by higher silhouette-index and strong correlation with work readiness score. To evaluate the clustering effectiveness, it is implemented on an e-learning system to generate adaptive instructions. The e-learning system is a supplement for fundamental programming course in the school. The t-test result shows that learning gain of experiment group is significantly higher that of the control group. Therefore, the proposed method is effective in improving students' learning quality. Copyright © 2018 Inderscience Enterprises Ltd.",Adaptive metacognitive instructions; Learning system; Likert scale analysis; Student clustering; Vocational high school cluster analysis; cognition; data set; learning; numerical model; secondary education; student
Research methodology for analysis of E-commerce user activity based on user interest using web usage mining,"Visitor interaction with e-commerce websites generates large amounts of clickstream data stored in web access logs. From a business standpoint, clickstream data can be used as a means of finding information on user interest. In this paper, the authors propose a method to find user interest in products offered on e-commerce websites based on web usage mining of clickstream data. In this study, user interest was investigated using the PIE approach coupled with clustering and classification techniques. The experimental results showed that the method is able to assist in analyzing visitor behavior and user interest in e-commerce products by identifying those products that prompt visitor interest. © 2018 Published by ITB Journal Publisher.",Classification; Clickstream; Data mining; E-commerce; User interest; Web access log; Web usage mining 
Semi-supervised learning approach for Indonesian Named Entity Recognition (NER) using co-training algorithm,"The problem of utilizing machine learning approach in Indonesian Named Entity Recognition (NER) system is the limited amount of labelled data for training process. However, unlike the limited availability of labelled data, unlabelled data is widely available from many sources. This enables a semi-supervised learning approach to solve this NER system problem. This research aims to design a semi-supervised learning model to solve NER system problem. A semi-supervised co-training learning is used to utilize unlabelled data in NER learning process to produce new labelled data that can be applied to enhance a new NER classi□cation system. This research uses two kinds of data, Indonesian DBPedia data as labelled data and news article text from Indonesian news sites (kompas.com, cnnindonesia.com, tempo.co, merdeka.com and viva.co.id) as unlabelled data. The pre-processing steps applied to analyze unstructured text are sentence segmentation, tokenization, stemming, and PoS Tagging. The results of this pre-process are the NER and its context used as unlabelled data for the semi-supervised co-training process. The SVM algorithm is used as a classi□cation algorithm in this process. 10 Cross Fold Validation is used as the system testing approach. Based on the result of the NER testing system, the precision is 73.6%, the recall is 80.1% and f1 mean is 76.5%. © 2016 IEEE.",Bahasa Indonesia; Co-Training; F1Score; Labelled Data; NER; Precision; Recall; Semi-Supervised Learning; SVM; Un-labelled Data Computational linguistics; Learning algorithms; Learning systems; Natural language processing systems; Positive ions; Problem solving; Co-training; F1 scores; Indonesia; Labelled Data; Precision; Recall; Semi- supervised learning; Un-labelled Data; Supervised learning