Sentiment analysis on product review using support vector machine (SVM),"Public opinion can influence an organization or a company profile. It is important for the company to evaluate public response regarding their products. However, monitoring and organizing of public opinion are not easy. There are many published opinions in social media that is difficult to be processed manually. Therefore, a technique for automatically categorizing public reviews into positive or negative is needed. This research examined the classification of user reviews on products Windows Phone by implementing Support Vector Machine (SVM). This study used four different methods in tokenization stage: unigram, bigram, trigram, and n-gram. In the preprocessing data, there were 8 experiments whereas each group implemented 2 stemming algorithms (Snowball Stemmer and Iterated-Lovin Stemmer). The results were used as input of classification. Each input was classified 3 times with values C 0.25, 0.5, and 1.0. In conclusion, the result yielded the most appropriate model from n-gram with algorithm Iterated-Lovin Stemmer and C value 1.0. Finally, the use of SVM proves to be feasible approach of sentiment analysis regarding specific product. © 2019 IEEE.",Bigram; N-gram; Sentiment analysis; Support vector machine; Trigram; Unigram Sentiment analysis; Social aspects; Appropriate models; Company profile; Product reviews; Public opinions; Public review; Stemming algorithms; Tokenization; Windows phones; Support vector machines
What is informatics education students’impression of using metacognitive training system at the first time?,"The use of Metacognitive Training System (MTS) is relatively new in Indonesia. Previously, a prototype of MTS has been developed and applied in Universitas Gadjah Mada. To become a massive product, the prototype of the MTS must be tested on a larger scale. It is intended to capture user impression about a new product. In this paper, we present User Experience (UX) measurement for the developed MTS in larger scale, involving 90 undergraduate students of informatics education at Universitas Negeri Malang. Two UX measurement methods are used, including User Experience Questionnaires (UEQ) and short-interview. UEQ is used for capturing general impressions, whereas, short-interview is conducted to get deeper feedback about the efficacy of the MTS in their studies. The UX measurement result is benchmarked and revealed that Attractiveness, Efficiency, and Stimulation categorized excellent and the interview result shows that more than 75% respondent responds with the positive answer in five questions. With this result, it could be concluded that the MTS is ready for massive product. © 2018 IEEE.",Metacognitive training system; Student impression; User experience Informatics; Information systems; Information use; Surveys; Indonesia; Informatics education; Measurement methods; Metacognitives; Training Systems; Undergraduate students; User experience; User experiences (ux); Students
User-centered design on metacognitive training system: A case in algorithm and data structure course,"Metacognitive training system (MTS) is a computer-based learning system aimed at developing students' metacognition. Metacognition is needed to develop students' self-regulation which is required for learning complex topics such as algorithm and data structure (ADS). Previously, we develop an MTS to support algorithm-learning. However, the approach tends to be technology-centered, thus, producing low usability score. Therefore, this paper proposes an incorporation of user-centered design (UCD) into the development of the MTS to produce a more usable system. As a result, new information architecture, wireframe, and user interface design are obtained. Finally, the system usability testing is conducted to compare two versions of the MTS, i.e. older and newer version. The result shows that the newer version has higher usability scale. In addition, the newer version of the MTS shows a positive impact on a real learning situation, indicated by the significant difference on students' performance between control and experiment group. © 2018 IEEE.",Algorithm and data structure; Metacognitive training system; User interface design; User-centered design Cognitive systems; Curricula; Data structures; Learning algorithms; Software design; Students; User centered design; Algorithm learning; Computer-based learning systems; Information architectures; Learning situation; Students' performance; Training Systems; User Centered Design(UCD); User interface designs; User interfaces
A Framework for Improving Recommendation in Adaptive Metacognitive Scaffolding,"Metacognitive scaffolding is an important pedagogical support to encourage self-regulated learning, especially in computer-based learning environments. Currently, an e-learning system which is complemented by metacognitive scaffolding has been developed. The scaffolding includes a recommendation system given by a virtual pedagogical agent. However, an academic satisfaction evaluation on the system reveals that the recommendation is less helpful. Therefore, this paper proposes a framework for providing a better recommendation. Two types of recommendations are aimed, including recommendation for the definition of learning goal/sub-goal and learning strategy. Goal/sub-goal recommendation is generated by identifying students' level of prior knowledge by using text classification algorithm. On the other hand, the strategy-use recommendation is generated by modeling the fitness of previously used learning strategy using fuzzy inference system and analyzing students' interaction log with the learning strategy. Implementation of the proposed scheme produces a prototype of the recommendation system. An A/B testing is conducted to compare previous and newer recommendation systems. The test shows that most of the users prefer to use the improved recommendation system. © 2018 IEEE.",algorithm learning; fuzzy inference system; metacognitive scaffolding; recommendation; student modeling Classification (of information); Computer aided instruction; E-learning; Fuzzy inference; Fuzzy systems; Inference engines; Learning systems; Scaffolds; Students; Text processing; Algorithm learning; Fuzzy inference systems; Metacognitive scaffoldings; recommendation; Student Modeling; Recommender systems
Tahani model of fuzzy database for an adaptive metacognitive scaffolding in Hypermedia Learning Environment (Case: Algorithm and structure data course),"Studies show that an adaptive learning environment is needed by learners. Adaptive e-learning systems have been developed with personalized instructions based on student's knowledge level. Since each student has a unique cognitive and metacognitive level, we currently develop an adaptive Hypermedia Learning Environment (HLE) for Algorithm and Data Structure Course based on a metacognitive awareness level. HLE provides adaptive scaffolding as instructional interventions to facilitate students' aptitude in programming. Scaffolding can be determined by knowing student's metacognitive awareness level. In this research, we propose the use of Tahani Model of Fuzzy Database in web-based HLE to support the adaptive decision-making. Tahani is one of some feasible models in a fuzzy database that can categorize students' metacognitive awareness level. The produced fuzzy rules have been validated by metacognitive experts of educational psychology. A hundred students have been categorized into three groups (low, medium, high) and provided with appropriate scaffolding. Evaluation results verified the suitability of the proposed method and the student's scaffolding. © 2017 IEEE.",adaptive; e-learning; fuzzy database; metacognitive; scaffolding; Tahani model Adaptive systems; Database systems; Decision making; E-learning; Fuzzy inference; Hypermedia systems; Learning algorithms; Learning systems; Scaffolds; Students; Sustainable development; adaptive; Adaptive e-learning systems; Adaptive hypermedia learning; Adaptive learning environment; Fuzzy database; Hypermedia learning environments; Metacognitives; scaffolding; Computer aided instruction
Heuristic evaluation and user testing with ISO 9126 in evaluating of decision support system for recommendation of outstanding marketing officer,"Multi-Criteria Decision Making in implementation of the Decision Support System (DSS) at BRI Katamso Yogyakarta helps decision makers in providing alternative decisions to choose the outstanding marketing office (MO) with DSS process. After implementation DSS in BRI Katamso, the next step is to evaluate the DSS. The purpose of this paper is to evaluate the DSS by using heuristic evaluation and ISO 9126. Evaluation is needed to test whether the system as expected. An evaluation of the designed system is expected to answer if any problems and improve goal attainment. ISO 9126 works to determine the level of effectiveness, efficiency, satisfaction. Heuristic Evaluation have function to evaluate the User Interface of DSS. Based on the ISO and heuristic evaluation, the general design of the interface and some of the factors effectiveness, efficiency, satisfaction vielded the average value of 3.75 (on a scale of 5). © 2017 IEEE.",BRI Katamso; DSS; Heuristic Evaluation; ISO 9126; Marketing Officer Artificial intelligence; Commerce; Decision making; Efficiency; Marketing; User interfaces; BRI Katamso; Decision makers; Decision support system (dss); General designs; Goal attainment; Heuristic evaluation; Iso 9126; Multi criteria decision making; Decision support systems
Enhancing student clustering to generate adaptive metacognitive instructions in learning system for vocational high school,"Adaptivity in learning systems depends on accuracy of learner modelling. Specifically, for generating cluster-based instructions, quality of student clustering is critical. Studies on student clustering are abundant; however, a system for clustering metacognitive that considers proper analysis technique of Likert-scaled dataset is unavailable. This article proposes a student clustering method which uses a new Likert scale analysis. It is performed on a dataset collected from 81 students of a vocational high school. The performance was compared to previous methods; enhancement is shown by higher silhouette-index and strong correlation with work readiness score. To evaluate the clustering effectiveness, it is implemented on an e-learning system to generate adaptive instructions. The e-learning system is a supplement for fundamental programming course in the school. The t-test result shows that learning gain of experiment group is significantly higher that of the control group. Therefore, the proposed method is effective in improving students' learning quality. Copyright © 2018 Inderscience Enterprises Ltd.",Adaptive metacognitive instructions; Learning system; Likert scale analysis; Student clustering; Vocational high school cluster analysis; cognition; data set; learning; numerical model; secondary education; student
Research methodology for analysis of E-commerce user activity based on user interest using web usage mining,"Visitor interaction with e-commerce websites generates large amounts of clickstream data stored in web access logs. From a business standpoint, clickstream data can be used as a means of finding information on user interest. In this paper, the authors propose a method to find user interest in products offered on e-commerce websites based on web usage mining of clickstream data. In this study, user interest was investigated using the PIE approach coupled with clustering and classification techniques. The experimental results showed that the method is able to assist in analyzing visitor behavior and user interest in e-commerce products by identifying those products that prompt visitor interest. © 2018 Published by ITB Journal Publisher.",Classification; Clickstream; Data mining; E-commerce; User interest; Web access log; Web usage mining 
Semi-supervised learning approach for Indonesian Named Entity Recognition (NER) using co-training algorithm,"The problem of utilizing machine learning approach in Indonesian Named Entity Recognition (NER) system is the limited amount of labelled data for training process. However, unlike the limited availability of labelled data, unlabelled data is widely available from many sources. This enables a semi-supervised learning approach to solve this NER system problem. This research aims to design a semi-supervised learning model to solve NER system problem. A semi-supervised co-training learning is used to utilize unlabelled data in NER learning process to produce new labelled data that can be applied to enhance a new NER classi□cation system. This research uses two kinds of data, Indonesian DBPedia data as labelled data and news article text from Indonesian news sites (kompas.com, cnnindonesia.com, tempo.co, merdeka.com and viva.co.id) as unlabelled data. The pre-processing steps applied to analyze unstructured text are sentence segmentation, tokenization, stemming, and PoS Tagging. The results of this pre-process are the NER and its context used as unlabelled data for the semi-supervised co-training process. The SVM algorithm is used as a classi□cation algorithm in this process. 10 Cross Fold Validation is used as the system testing approach. Based on the result of the NER testing system, the precision is 73.6%, the recall is 80.1% and f1 mean is 76.5%. © 2016 IEEE.",Bahasa Indonesia; Co-Training; F1Score; Labelled Data; NER; Precision; Recall; Semi-Supervised Learning; SVM; Un-labelled Data Computational linguistics; Learning algorithms; Learning systems; Natural language processing systems; Positive ions; Problem solving; Co-training; F1 scores; Indonesia; Labelled Data; Precision; Recall; Semi- supervised learning; Un-labelled Data; Supervised learning
Risk model development for information security in organization environment based on business perspectives,"Digital information plays an essential role in supporting organizational business. However, incidents of sensitive information leakage often happen in organization environment. Therefore, risk analysis needs to be performed to recognize the impact of information security threat in organization. In order to carry out those risk analyses, risk model is needed to map risk of information security threat. The selection of proper risk model provides proper result related to risk analysis. The proper risk model must have objectivity and appropriate context. However, most of the existing risk models focus on the technical approach and use expert judgment as a weighting method. Meanwhile, organizations use business perspectives to determine decisions. Therefore, this study has the objective to fill the needs of organizations by developing a new risk model. The proposed risk model focuses on business aspects involvement and reducing subjective methods. The proposed risk model also uses three processes to result output, i.e., adaptable classification data, data measurement and cross-label analysis. Test mining and categorical clustering are involved to handle those three processes. Testing of the proposed model is carried out to define ability and limitation of model by involving 30 targets. The result states that the proposed model has advantages in objectivity, context approach and detailed output, while the limited scope of work becomes weakness of these models. © 2020, Springer-Verlag GmbH Germany, part of Springer Nature.",Categorical clustering; Information security; Risk model; Text mining Ability testing; Risk analysis; Security of data; Security systems; Business aspects; Business perspective; Categorical clustering; Data measurements; Digital information; Information security threats; Sensitive informations; Subjective methods; Risk assessment
Study on the influencing factors of the flexibility of university IT management in Education 4.0,"Education systems at all levels should embrace new technologies to comply with Industry 4.0 developments. Universities need to adapt to these new changes. However, studies that discuss the flexibility in service-based organisations are limited. The study of IT flexibility currently focuses on manufacturing organisations in aspects of IT infrastructure. IT infrastructure flexibility is only a part of IT resources that is managed in IT management. The contribution of this study is to produce variables that significantly influence the flexibility of IT management in the university. T tests obtained six variables with a significant direct effect; they are data integration, modularity of an application, value drivers, human resource competence, human resource development and knowledge sharing. R square test shows that these variables also simultaneously influence the flexibility of IT management universities with a fairly high influence of 76%. Copyright © 2021 Inderscience Enterprises Ltd.",Application modularity; Data integration; Education 4.0; HR competencies; HR development; IT flexibility; IT infrastructure flexibility; IT management; Knowledge sharing management; University changed; Value drivers data set; education; educational development; human resource; information technology; resource development; university sector
A review on smartphone usage data for user identification and user profiling,"The amount of retrievable smartphone data is escalating; while some apps on the smartphone are evidently exploiting and leaking users' data. These phenomena potentially violate privacy and personal data protection laws as various studies have showed that technologies such as artificial intelligence could transform smartphone data into personal data by generating user identification and user profiling. User identification identifies specific users among the data based upon the users' characteristics and users profiling generates users' traits (e.g. age and personality) by exploring how data is correlated with personal information. Nevertheless, the comprehensive review papers discussing both of the topics are limited. This paper thus aims to provide a comprehensive review of user identification and user profiling using smartphone data. Compared to the existing review papers, this paper has a broader lens by reviewing the general applications of smartphone data before focusing on smartphone usage data. This paper also discusses some possible data sources that can be used in this research topic. © 2021 Komunitas Ilmuwan dan Profesional Muslim Indonesia. All right reserved.",Privacy; Smartphone Usage Data; User Identification; User Profiling 
Virtual Reality Mobile Application Development with Scrum Framework as a New Media in Learning English,Scrum software development has brought new ideas and tools in the software development industry. This study is a finding that the scrum can be a guideline for building mobile-based Virtual Reality applications as a new medium for learning English that is still conventional and has not applied technology to support the teaching and learning process of learning English. Scrum Software provides a framework for managing the iterative and incremental process for building VR applications. The results of this study indicate that a series of Sprint plans contained in the Scrum method have a positive impact and affect the quality of virtual reality mobile application games in English learning and also reveal the theoretical and practical implications that repeated feedback has a moderating effect on the relationship between Sprint planning and quality in VR games. © 2021. All Rights Reserved.,C#; Education; Game Development; Mobile learning; Scrum; Unity3D; Virtual Reality 
Application for Detection of Pedestrian Position on Zebra Cross,"Zebra cross is a crossing facility, but some people choose to cross outside the crossing area. Location tracking is a technology used to observe or track moving or stationary objects and provide location data for further processing. In this study, location tracking uses the location-based service algorithm designed on the Android system to map crossing facilities, especially the zebra cross. This system maps the position of longitude and latitude zebra cross. It tracks the status of pedestrians who will then compare the distance between the zebra crossing with the pedestrian, so it is expected to help pedestrians cross safely. The results of the experiment show that functionally the application has been able to map the position of the zebra crossing and the position of a crosser. However, the point reading of this app is still not perfect. © 2020 IEEE.",android; Global Positioning System (GPS); location tracking; Location-Based Service; Zebra cross Crosswalks; Data handling; Intelligent systems; Location; Object tracking; Telecommunication services; Android systems; Crossing area; Location data; Pedestrian position; Stationary objects; Location based services
Multi-Point Travel Destination Recommendation System in Yogyakarta Using Hybrid Location Based Service-Floyd Warshall Method1,"Yogyakarta is one of the cities that has a high level of tourist visits. In a span of 4 years, the increase in local tourists reached 71% and 64% of foreign tourists. Increasing the number of tourists is not a problem-free process, especially as visit preferences change over time. The challenge in this research is how to find alternative tourism objects which are located around the destination route with the fastest route, so as to shorten the travel time. In this study, the multi-point tourism recommendation system using Location-Based Service (LBS) is designed to find out tourist locations from the current location to the point of locations you want to visit but with a radius of 9 km. The application of the Floyd Warshall algorithm to this system will help tourists find the best route to the chosen tourist location. From the test results obtained an accuracy rate of 90% © 2020 IEEE.",Android; Floyd Warshall; GPS; LBS; Travel Recommendation Intelligent systems; Location; Recommender systems; Telecommunication services; Tourism; Travel time; Accuracy rate; Destination recommendations; Fastest route; Floyd-warshall; Floyd-Warshall algorithms; Multi-points; Location based services
Pre-processing Task for Classifying Satire in Indonesian News Headline,"One of challenges in the topic of natural language processing is detecting satire sentences. In the news headlines, satire commonly used to criticize the goverment. This study aims to know the impact of preprocessing in the classification of satire sentences in Indonesian news headlines. Besides, feature extraction was conducted by using Term Frequency Inverse Document frequency (TF-IDF) employing Machine Learning: Naive Bayes to classify the satire in Indonesian news headline. In thisstudy, there were six preprocessing combinations used which were; breaking down the word into tokens (tokenizing), changing word into base form (stemming), removing stopword, and removing punctuation. The result showed that preprocessing affected the accuracy of sarcastic sentence classification which are not on the dataset of Indonesian news headlines. The highest accuracy of 90.38% obtained by combination of standardized preprocessing which were tokenizing and lowercasing. © 2020 IEEE.",Machine Learning; Natural Language Processing; Preprocessing; Satire Natural language processing systems; Text processing; Goverment; Naive bayes; NAtural language processing; Pre-processing; Sentence classifications; Term frequencyinverse document frequency (TF-IDF); Tokenizing; Classification (of information)
Research trend on the use of it in digital addiction: An investigation using a systematic literature review,"Despite the negative role of IT in digital addiction development, IT may have a positive role in dealing with digital addiction. The present study undertakes a systematic literature review to explore the state of play and the trend regarding the use of IT in digital addiction research. Using predefined keywords, the Scopus database was searched for relevant literature published from 2017 to 2020. The initial search found 1655 papers. Six stages of study selection were completed using a set of inclusion and exclusion criteria. The study selection and quality assessment process were applied, then 15 papers were selected for further review. The results show that addiction detection using IT is the most researched topic in digital addiction research. The most commonly used IT in the selected studies are AI methods and biosignal recording systems. Various approaches in detection, prevention, and intervention are suggested in the selected studies. The advantages and limitations of each approach are discussed. Based on these results, some future research directions are suggested. © 2020 by the authors. Licensee MDPI, Basel, Switzerland.",Detection; Digital addiction; Information technology; Internet addiction; Intervention; Prevention Future research directions; Inclusion and exclusions; Quality assessment; Recording systems; Research trends; Scopus database; Six stages; Systematic literature review; Internet
